{"run":24,"commit":"c08c4f8","metric":63901,"metrics":{"seed_us":372044,"search_us":19582,"prompt_us":19045,"save_us":24591,"list_us":779,"records":1032},"status":"discard","description":"Add slim search_summaries for prompt_context to avoid copying vectors; duplicated search path regressed.","timestamp":1777905655345,"segment":0,"confidence":105.14395108997715,"asi":{"hypothesis":"prompt_context only needs memory text/categories, so a slim search path that avoids copying vectors and metadata should reduce pre-model memory injection latency.","rollback_reason":"Primary total_us regressed badly (63,901 vs 53,592), especially prompt_us; duplicated search/field-copy code was slower than the optimized shared search path despite copying less vector data.","next_action_hint":"Do not add a separate summary search path this way. If prompt_context needs optimization, reduce formatting/truncate work or refactor shared top-k code without duplicating candidate assembly."}}
{"run":25,"commit":"8fb4480","metric":46039,"metrics":{"seed_us":348055,"search_us":19721,"prompt_us":9686,"save_us":15696,"list_us":761,"records":1032},"status":"keep","description":"Drop unused scope/hash SQLite indexes now that reads use the in-process cache.","timestamp":1777905717440,"segment":0,"confidence":112.53941826796526,"asi":{"hypothesis":"After cached list/search, the scope and hash indexes are no longer used by memory read paths, but every save still pays to maintain them; dropping unused indexes should reduce write latency without changing query behavior.","why_it_worked":"Save and seed phases improved substantially because each INSERT updates fewer SQLite indexes. The updated_at index remains for initial cache load ordering, and id lookups still use the primary key.","semantic_risk":"Low-medium: current code does not query by scope/hash in SQLite, but dropping indexes could hurt future external/manual SQL queries or future features that search by hash unless they recreate an index."}}
{"run":26,"commit":"8fb4480","metric":46814,"metrics":{"seed_us":335044,"search_us":20113,"prompt_us":9886,"save_us":15723,"list_us":1049,"records":1032},"status":"discard","description":"Also drop updated_at SQLite index, leaving memory table unindexed except primary key; primary regressed.","timestamp":1777905766572,"segment":0,"confidence":134.10303861987845,"asi":{"hypothesis":"After the cache takes over list/search, even the updated_at index may be unnecessary; dropping it should further reduce insert/index maintenance costs.","rollback_reason":"Primary total_us regressed versus best (46,814 vs 46,039); seed improved but steady search/prompt/list noise and initial cache ordering cost outweighed write savings.","next_action_hint":"Keep the updated_at index. It is still useful for deterministic initial cache load ordering and does not dominate steady save cost after dropping scope/hash indexes."}}
{"run":27,"commit":"8fb4480","metric":46201,"metrics":{"seed_us":350846,"search_us":19885,"prompt_us":9972,"save_us":15559,"list_us":742,"records":1032},"status":"discard","description":"Compute save embedding/vector norm once and reuse it for duplicate check and persisted record; primary regressed slightly.","timestamp":1777905879524,"segment":0,"confidence":165.88893200116402,"asi":{"hypothesis":"Memory save embeds the same text once for near-duplicate detection and again for persistence; computing the vector and norm once should reduce save latency without changing dedupe semantics.","rollback_reason":"Primary total_us regressed versus best (46,201 vs 46,039) despite save_us slightly improving; search/prompt noise outweighed the small save win and signature churn did not justify keeping.","next_action_hint":"Embedding reuse may be a tiny save-only improvement but is within noise for total UX metric; focus on bigger retrieval/search or write-index costs."}}
{"run":28,"commit":"8fb4480","metric":72253,"metrics":{"seed_us":339755,"search_us":37824,"prompt_us":18248,"save_us":15131,"list_us":753,"records":1032},"status":"discard","description":"Skip categories_match calls when no category filter is present in cached list/search; retrieval regressed badly.","timestamp":1777905938910,"segment":0,"confidence":134.10303861987845,"asi":{"hypothesis":"Most search and prompt_context calls have no category filter, so avoiding categories_match on the hot path should reduce retrieval latency without changing filtering semantics.","rollback_reason":"Primary total_us regressed versus best (72,253 vs 46,039), with search and prompt roughly doubling; the added branch/counter structure likely hurt the optimized no-filter path or caused unfavorable code generation.","next_action_hint":"Do not special-case empty category filters this way. Keep the simple categories_match path; future retrieval optimization should reduce similarity comparisons or candidate copies instead."}}
{"run":29,"commit":"3f455d7","metric":18837,"metrics":{"seed_us":246760,"search_us":6170,"prompt_us":2968,"save_us":8950,"list_us":828,"records":1032},"status":"keep","description":"Cache sparse vector entries and use sparse dot products for memory similarity scans.","timestamp":1777906148758,"segment":0,"confidence":168.5275972451256,"asi":{"hypothesis":"Hash embeddings are sparse even though stored as 512-float dense vectors; caching non-zero entries per memory and comparing sparse vectors should reduce search and duplicate-check CPU while preserving exact cosine semantics.","why_it_worked":"Search, prompt_context, save, and seed phases all improved because similarity scans now merge sparse non-zero indices instead of multiplying all 512 dimensions for every candidate; dense vectors are still persisted for compatibility.","semantic_risk":"Low-medium: scores remain true cosine using the same dense values and cached norms, but MemoryRecord copies now include sparse entries and cache memory usage increases modestly."}}
{"run":30,"commit":"3f455d7","metric":19739,"metrics":{"seed_us":248080,"search_us":6262,"prompt_us":2819,"save_us":9538,"list_us":869,"records":1032},"status":"discard","description":"Compute sparse entries and vector norm in one pass; regressed and left vector_norm unused.","timestamp":1777906237923,"segment":0,"confidence":133.084453636677,"asi":{"hypothesis":"After sparse-vector caching, record/query setup still scans dense vectors once for norm and once for sparse entries; combining those into one pass should reduce setup overhead.","rollback_reason":"Primary total_us regressed versus sparse-vector best (19,739 vs 18,837), with save/list slower; the combined helper also made the old vector_norm helper unused and produced a warning.","next_action_hint":"Keep the simpler separate norm/sparse helpers. The main sparse-dot win is already captured; further improvements should avoid adding per-record storage/copy overhead or target SQLite writes."}}
{"run":31,"commit":"3e9c29a","metric":11290,"metrics":{"seed_us":176960,"search_us":3845,"prompt_us":1808,"save_us":4787,"list_us":860,"records":1032},"status":"keep","description":"Use dense-query/sparse-record dot products instead of merging two sparse vectors.","timestamp":1777906287278,"segment":0,"confidence":122.32022432527164,"asi":{"hypothesis":"Query vectors are already dense in memory, so sparse similarity can iterate only each cached record's non-zero entries and index into the query instead of constructing/merging a query sparse vector.","why_it_worked":"Search, prompt_context, save duplicate checks, and seed improved because each comparison became a straight loop over record non-zero entries with fewer branches and no query sparse allocation.","semantic_risk":"Low: dot product and cosine normalization are mathematically identical to the previous sparse merge and dense cosine paths for the same stored vectors."}}
{"run":32,"commit":"7657f8c","metric":11117,"metrics":{"seed_us":174574,"search_us":3790,"prompt_us":1769,"save_us":4624,"list_us":837,"records":1032},"status":"keep","description":"Cache inverse vector norms and use multiply instead of per-comparison division.","timestamp":1777906344248,"segment":0,"confidence":113.88201128984892,"asi":{"hypothesis":"Similarity scans still divide by query_norm * stored_norm for every candidate; caching inverse stored norms and computing the query inverse once should reduce arithmetic cost while preserving cosine ordering.","why_it_worked":"Small but consistent improvements in search, prompt, save, and seed by replacing hot-loop division with multiplication over sparse dot products.","semantic_risk":"Low: scores differ only by normal floating-point operation ordering; zero-norm vectors still score 0."}}
