{"type":"config","name":"Optimize pi-lite local memory operations","metricName":"total_us","metricUnit":"µs","bestDirection":"lower"}
{"run":1,"commit":"setup","metric":1756188,"metrics":{"seed_us":6641984,"search_us":785280,"prompt_us":393426,"save_us":369313,"list_us":211560,"records":1032},"status":"checks_failed","description":"Baseline benchmark setup ran, but product build check failed on missing STDERR_FILENO include in existing src/agent.cpp.","timestamp":1777903912724,"segment":0,"confidence":null,"asi":{"hypothesis":"Establish a representative memory operations baseline before optimizing.","rollback_reason":"Correctness checks failed because building the full pi-lite target now reports STDERR_FILENO undeclared in src/agent.cpp.","next_action_hint":"Add the missing unistd include or otherwise restore product build, then rerun the baseline setup."}}
{"run":2,"commit":"be36c76","metric":1760463,"metrics":{"seed_us":6677557,"search_us":786698,"prompt_us":392516,"save_us":374962,"list_us":209912,"records":1032},"status":"keep","description":"First passing memory benchmark baseline plus benchmark/check infrastructure and STDERR_FILENO build fix.","timestamp":1777904040351,"segment":0,"confidence":null,"asi":{"hypothesis":"Create a stable representative benchmark and fix the product build so future memory optimizations have correctness backpressure.","benchmark_shape":"1000 seeded memories, 96 searches, 48 prompt_context retrievals, 32 steady saves, 32 list calls, 5-trial median.","build_fix":"Added <unistd.h> to src/agent.cpp for STDERR_FILENO on POSIX builds."}}
{"run":3,"commit":"be36c76","metric":1875638,"metrics":{"seed_us":6620418,"search_us":926487,"prompt_us":460752,"save_us":414327,"list_us":69601,"records":1032},"status":"discard","description":"Avoid vector/metadata materialization for list/search and partial-sort top-k; list got faster but search/save worsened overall.","timestamp":1777904228542,"segment":0,"confidence":1,"asi":{"hypothesis":"Skipping vector allocation and metadata JSON parsing in list/search would reduce steady-state retrieval latency.","rollback_reason":"Primary total_us regressed by ~6.5%; direct BLOB scoring plus per-row category parsing and extra code path made search/prompt/save slower despite list_us dropping from ~210k to ~70k.","next_action_hint":"Keep the list-specific projection idea separate; for search focus on category parsing, prepared statements, or avoiding repeated full scans rather than BLOB direct scoring as implemented.","phase_learning":"list projection is promising, search direct blob scoring is not in this form."}}
{"run":4,"commit":"be36c76","metric":2119206,"metrics":{"seed_us":7322494,"search_us":1048531,"prompt_us":524421,"save_us":472179,"list_us":68687,"records":1032},"status":"discard","description":"Split list into lightweight projection while keeping search full-record scan; list improved but search/save regressed badly.","timestamp":1777904357109,"segment":0,"confidence":0.07157806613645877,"asi":{"hypothesis":"Use a lightweight SELECT for public list while keeping search semantics with the original full record scan.","rollback_reason":"Primary total_us regressed ~20%; duplicating search's SQL path rather than using list likely changed planner/cache behavior and hurt dominant search/save phases, swamping list gains.","next_action_hint":"Do not split search/list this way. Try optimizing the existing shared list path in-place, or address save/search scan count with SQL hash exact dedupe before vector near-duplicate scan.","surprise":"Even semantically similar full-record search path was much slower than search calling list(), suggesting benchmark is sensitive to extra code/prepare path or noise; confirm with simpler changes."}}
{"run":5,"commit":"38cf2ca","metric":1690740,"metrics":{"seed_us":6403911,"search_us":747819,"prompt_us":371239,"save_us":363570,"list_us":204968,"records":1032},"status":"keep","description":"Use partial_sort for top-k memory search instead of fully sorting all scored candidates.","timestamp":1777904458101,"segment":0,"confidence":0.9386859429456564,"asi":{"hypothesis":"Memory search only returns a small top_k, so partial_sort should reduce dominant ranking cost without changing results or storage semantics.","why_it_worked":"Keeps the same candidate scan, scoring, thresholding, and tie-break comparator, but avoids fully ordering discarded tail candidates; improves search, prompt_context, and save near-duplicate phases.","semantic_risk":"Low: top-k ordering uses the same comparator as the previous full sort for returned records."}}
{"run":6,"commit":"38cf2ca","metric":1710842,"metrics":{"seed_us":6458063,"search_us":753833,"prompt_us":375080,"save_us":369916,"list_us":205272,"records":1032},"status":"discard","description":"Assume normalized embeddings and compute cosine as dot product only; result was slower/noisy versus partial_sort best.","timestamp":1777904544414,"segment":0,"confidence":1.1375435608200297,"asi":{"hypothesis":"Because HashEmbedder normalizes stored/query vectors, cosine similarity can skip norm and sqrt work and use only dot product.","rollback_reason":"Primary total_us was worse than the previous kept partial_sort run (1,710,842 vs 1,690,740); any theoretical arithmetic savings were lost in noise or not dominant versus SQLite/materialization costs.","next_action_hint":"Focus on reducing rows/materialization/SQL work rather than scalar cosine math; if revisiting, benchmark repeated runs or combine with vector storage changes.","correctness_note":"Semantic risk is low for current normalized vectors, but legacy unnormalized DBs would score differently."}}
{"run":7,"commit":"81d220a","metric":1690302,"metrics":{"seed_us":6420857,"search_us":742850,"prompt_us":370706,"save_us":368829,"list_us":204877,"records":1032},"status":"keep","description":"Reserve memory list result capacity before scanning SQLite rows.","timestamp":1777904622575,"segment":0,"confidence":1.0066923359002566,"asi":{"hypothesis":"Preallocating the list/search candidate vector to the requested cap avoids repeated vector growth during each memory scan.","why_it_worked":"Small allocation reduction in the shared list path used by search, prompt_context, near-duplicate save, and list; primary gain is tiny and likely near noise but directionally consistent for search/prompt/list.","semantic_risk":"None: capacity reservation only."}}
{"run":8,"commit":"9922a14","metric":169003,"metrics":{"seed_us":3001481,"search_us":42611,"prompt_us":20933,"save_us":104525,"list_us":754,"records":1032},"status":"keep","description":"Add an in-process MemoryStore record cache and serve list/search scans from it while syncing writes.","timestamp":1777904751874,"segment":0,"confidence":36.91643019956273,"asi":{"hypothesis":"Memory operations repeatedly scan the same SQLite rows during a process; caching MemoryRecord rows in MemoryStore and updating the cache on add/update/delete should remove SQLite read/materialization latency without changing persisted storage.","why_it_worked":"Dominant search/prompt/list paths now iterate in-memory records instead of preparing SELECTs, reading BLOBs, and reparsing JSON on every call; save near-duplicate checks also reuse the cache.","correctness_guard":"SQLite remains source of persistence; add/update/delete still write the DB and log events before updating/removing cached records. Self-test with save/search/update/delete passed.","semantic_risk":"Medium: records changed by another process after the cache is loaded are not observed until a new MemoryStore is constructed; acceptable for pi-lite's in-process local-memory UX but worth documenting or adding invalidation later."}}
{"run":9,"commit":"d0c66ed","metric":92282,"metrics":{"seed_us":526981,"search_us":41272,"prompt_us":21324,"save_us":29026,"list_us":731,"records":1032},"status":"keep","description":"Use SQLite WAL synchronous=NORMAL for local memory writes and update research notes.","timestamp":1777904799391,"segment":0,"confidence":33.532294794542636,"asi":{"hypothesis":"Local memory can safely use WAL with synchronous=NORMAL to reduce fsync/write latency while retaining durable enough behavior for UX memory storage.","why_it_worked":"Write-heavy save phases dropped sharply because each memory save writes both the memory row and event log; search/list remained dominated by the in-process cache.","durability_tradeoff":"NORMAL in WAL may lose the latest transactions on OS crash/power loss but remains consistent and is a standard performance/durability tradeoff for local caches; not suitable if memory must be fully power-loss durable.","next_action_hint":"Further gains should target save's duplicate scan or event write overhead, not SQLite read paths."}}
{"run":10,"commit":"006fd19","metric":88538,"metrics":{"seed_us":401025,"search_us":41338,"prompt_us":19901,"save_us":26899,"list_us":811,"records":1032},"status":"keep","description":"Add has_similar fast path for save duplicate checks to avoid building search results.","timestamp":1777904876254,"segment":0,"confidence":14.221875413079538,"asi":{"hypothesis":"Save only needs to know whether a near-duplicate exists, so it can scan cached records and return a bool instead of calling top-k search and allocating/sorting result records.","why_it_worked":"Write-heavy seed/save phases improved by avoiding candidate copies, threshold erase, and ranking work during duplicate checks; search/list behavior for user-facing retrieval is unchanged.","semantic_risk":"Low: duplicate check threshold and scope filtering are unchanged; returned duplicate records were never used by save."}}
{"run":11,"commit":"d3eed76","metric":69066,"metrics":{"seed_us":391243,"search_us":28946,"prompt_us":13087,"save_us":26270,"list_us":780,"records":1032},"status":"keep","description":"Search cached records directly and only copy candidates that pass the score threshold.","timestamp":1777904923119,"segment":0,"confidence":9.12460924401562,"asi":{"hypothesis":"After adding the in-memory cache, search should not call list() and copy every scanned MemoryRecord before scoring; it can score cache entries in place and copy only threshold-passing candidates.","why_it_worked":"Search/prompt phases dropped because below-threshold records are no longer copied with vectors/metadata before ranking; scan caps and category filtering mirror list() semantics.","semantic_risk":"Low-medium: preserves the previous 500-candidate effective search cap and 5000 scoped-row category scan cap, but the logic is now duplicated between list and search."}}
{"run":12,"commit":"d3eed76","metric":72923,"metrics":{"seed_us":393240,"search_us":30331,"prompt_us":13474,"save_us":27979,"list_us":801,"records":1032},"status":"discard","description":"Retry dot-product cosine after cache/search optimizations; still slower than normalized cosine baseline.","timestamp":1777904957592,"segment":0,"confidence":5.497284140488301,"asi":{"hypothesis":"Once SQLite/materialization overhead is removed, skipping cosine norm and sqrt work might improve cached search/save scans.","rollback_reason":"Primary total_us regressed versus the kept cached direct-search best (72,923 vs 69,066); repeated evidence shows cosine arithmetic is not the limiting factor or dot-only changes optimization behavior unfavorably.","next_action_hint":"Do not retry dot-only cosine unless vector representation changes substantially; focus on embedding generation, save write overhead, or prompt_context formatting."}}
{"run":13,"commit":"d3eed76","metric":71130,"metrics":{"seed_us":391988,"search_us":29904,"prompt_us":13677,"save_us":26255,"list_us":768,"records":1032},"status":"discard","description":"Avoid token vector and bigram string concatenation in HashEmbedder; benchmark regressed.","timestamp":1777905026604,"segment":0,"confidence":3.9335655531307707,"asi":{"hypothesis":"Embedding generation allocates token vectors and bigram concatenation strings; streaming token hashing with an equivalent pair hash should reduce query/save embedding overhead.","rollback_reason":"Primary total_us regressed versus cached direct-search best (71,130 vs 69,066), and the change introduced an unused tokenize warning after replacing its only caller.","next_action_hint":"Embedding allocation is not a worthwhile standalone target for this workload; if revisiting, remove tokenize and microbench embed equivalence separately before combining with larger changes."}}
{"run":14,"commit":"8f67eca","metric":56865,"metrics":{"seed_us":396755,"search_us":19843,"prompt_us":9836,"save_us":26369,"list_us":779,"records":1032},"status":"keep","description":"Maintain a bounded top-k set during cached search instead of collecting all threshold matches.","timestamp":1777905090462,"segment":0,"confidence":2.0248295337759945,"asi":{"hypothesis":"Cached search still copies every threshold-passing record and partial-sorts them; maintaining only the best top_k records during the scan should reduce copying and ranking work for retrieval.","why_it_worked":"Search and prompt_context phases dropped because only top_k records are copied, while every candidate still gets scored and compared with the same score/updated_at ordering.","semantic_risk":"Low-medium: returned top-k should match the previous comparator; tie behavior remains unspecified when score and updated_at are equal."}}
{"run":15,"commit":"4ac1d52","metric":54924,"metrics":{"seed_us":389928,"search_us":19400,"prompt_us":9588,"save_us":25405,"list_us":814,"records":1032},"status":"keep","description":"Cache vector norms and reuse each query norm during cached similarity scans.","timestamp":1777905173890,"segment":0,"confidence":14.913033950157347,"asi":{"hypothesis":"Preserve true cosine semantics while avoiding recomputing the stored vector norm for every cached search/save comparison by caching vector_norm in MemoryRecord.","why_it_worked":"Search, prompt, save, and seed phases improved modestly because each comparison now computes one dot product and divides by precomputed norms; unlike dot-only, this retains compatibility with non-normalized legacy vectors.","semantic_risk":"Low: scores remain true cosine; cached norm is populated when loading records and when saving/updating records.","cleanup_needed":"The old cosine_similarity wrapper became unused and produced a warning; remove it in a follow-up cleanup experiment."}}
{"run":16,"commit":"8dd0f2c","metric":53870,"metrics":{"seed_us":376862,"search_us":18858,"prompt_us":9235,"save_us":24921,"list_us":757,"records":1032},"status":"keep","description":"Remove unused cosine_similarity wrapper after norm-cache optimization.","timestamp":1777905204427,"segment":0,"confidence":22.326799614403473,"asi":{"hypothesis":"Cleaning up the unused wrapper removes compiler warning/noise and keeps the optimized similarity path focused on precomputed norms.","why_it_worked":"No semantic change; benchmark moved slightly faster likely from noise or reduced build/output overhead, and warning output is gone.","semantic_risk":"None: no call sites used the wrapper."}}
{"run":17,"commit":"8dd0f2c","metric":55728,"metrics":{"seed_us":384968,"search_us":19229,"prompt_us":9421,"save_us":25902,"list_us":790,"records":1032},"status":"discard","description":"Reuse memory row timestamp for ADD/UPDATE event logging to avoid extra now_iso8601 calls; regressed.","timestamp":1777905252003,"segment":0,"confidence":44.3173487451838,"asi":{"hypothesis":"Save/update call now_iso8601 more than once per persisted memory/event; passing the row timestamp into log_event should reduce timestamp formatting overhead.","rollback_reason":"Primary total_us regressed versus best (55,728 vs 53,870); timestamp formatting is not a dominant cost and the signature churn did not help.","next_action_hint":"Leave log_event API simple; focus on larger write batching or duplicate-scan reductions if optimizing saves further."}}
{"run":18,"commit":"8dd0f2c","metric":54137,"metrics":{"seed_us":383461,"search_us":19119,"prompt_us":9322,"save_us":25273,"list_us":749,"records":1032},"status":"discard","description":"Bind vector BLOBs directly instead of copying through a temporary string; slight regression.","timestamp":1777905304707,"segment":0,"confidence":46.75862826693036,"asi":{"hypothesis":"SQLite bind with SQLITE_TRANSIENT can copy directly from vector data, avoiding the extra vector_to_blob string allocation/copy during add/update saves.","rollback_reason":"Primary total_us was slightly worse than best (54,137 vs 53,870); save phase did not improve enough and result is within noise.","next_action_hint":"Temporary BLOB copy is not a worthwhile isolated change; if optimizing writes, consider batching or statement reuse instead."}}
{"run":19,"commit":"8dd0f2c","metric":55871,"metrics":{"seed_us":375148,"search_us":19033,"prompt_us":9330,"save_us":26294,"list_us":796,"records":1032},"status":"discard","description":"Wrap memory row insert and ADD event insert in one explicit transaction; regressed slightly.","timestamp":1777905374439,"segment":0,"confidence":49.484549867736405,"asi":{"hypothesis":"Combining the memory INSERT and memory_events INSERT into one explicit transaction should reduce write latency and improve atomicity for save operations.","rollback_reason":"Primary total_us regressed versus best (55,871 vs 53,870); with WAL+synchronous=NORMAL, explicit BEGIN/COMMIT overhead outweighed any benefit from grouping two inserts.","next_action_hint":"Do not pursue per-save explicit transactions. If save write overhead matters, try prepared statement reuse for add/log_event or larger batch APIs, not transaction wrapping."}}
{"run":20,"commit":"8dd0f2c","metric":54458,"metrics":{"seed_us":375149,"search_us":19286,"prompt_us":9736,"save_us":25021,"list_us":758,"records":1032},"status":"discard","description":"Cache prepared INSERT statements for memory rows and event logs; did not beat current best.","timestamp":1777905436078,"segment":0,"confidence":64.40124087315098,"asi":{"hypothesis":"Save still prepares/finalizes INSERT statements for both memories and memory_events every time; caching those sqlite3_stmt handles should reduce write overhead generally.","rollback_reason":"Primary total_us regressed versus best (54,458 vs 53,870); seed improved but steady total/search noise and added state did not produce a primary improvement.","next_action_hint":"Prepared add/log_event statement caching is not worth the extra mutable statement lifecycle as an isolated change. Consider reducing cache insertion cost or list copy cost next."}}
{"run":21,"commit":"c08c4f8","metric":53592,"metrics":{"seed_us":366374,"search_us":18983,"prompt_us":9312,"save_us":24517,"list_us":781,"records":1032},"status":"keep","description":"Store cache oldest-to-newest and append new records, iterating recent-first for list/search.","timestamp":1777905484472,"segment":0,"confidence":89.36104550464493,"asi":{"hypothesis":"upsert_cached_record inserts at the front of a vector on every save after cache load, making saves pay O(n) element shifts; storing cache oldest-to-newest and iterating reverse for recent-first reads should preserve behavior while making new saves append-only.","why_it_worked":"Seed and save phases improved because cache updates after each add no longer shift all cached MemoryRecords; list/search still see newest records first via reverse iteration.","semantic_risk":"Low-medium: preserves recent-first intent, but equal-second timestamps remain dependent on in-process insertion order similarly to the previous cache behavior."}}
{"run":22,"commit":"c08c4f8","metric":53940,"metrics":{"seed_us":360713,"search_us":19064,"prompt_us":9324,"save_us":24284,"list_us":763,"records":1032},"status":"discard","description":"Use float accumulation for cached cosine dot product; save improved but total regressed.","timestamp":1777905534334,"segment":0,"confidence":93.9544739673868,"asi":{"hypothesis":"Vectors are float embeddings, so accumulating dot products in float may reduce similarity scan cost enough while preserving practical ranking precision.","rollback_reason":"Primary total_us regressed versus best (53,940 vs 53,592); save/seed improved slightly but search/prompt got slower and precision semantics are marginally weaker.","next_action_hint":"Keep double accumulation for safer cosine semantics. If similarity scan remains a target, explore reducing comparisons rather than lowering arithmetic precision."}}
{"run":23,"commit":"c08c4f8","metric":54651,"metrics":{"seed_us":368487,"search_us":19034,"prompt_us":9454,"save_us":24776,"list_us":756,"records":1032},"status":"discard","description":"Reserve extra cache capacity after loading records to reduce add-time reallocations; regressed.","timestamp":1777905583957,"segment":0,"confidence":98.64403244495945,"asi":{"hypothesis":"When the cache is loaded and then new memories are saved, vector growth can copy large MemoryRecords; reserving headroom after load should reduce add-time reallocations.","rollback_reason":"Primary total_us regressed versus best (54,651 vs 53,592); vector growth was not a bottleneck or extra reservation hurt cache locality/noise.","next_action_hint":"Do not add fixed cache headroom. Cache append optimization was enough; further save wins likely need reducing duplicate-scan comparisons or persisted write cost."}}
